{
  "body": "Context (issue #489, residuals from #488's cross-model review): the toolkit floor shipped in #488 is enforced by files that are not themselves trust roots, the rails-guard CI job installs dependencies with lifecycle scripts enabled before running privileged gates, and the preflight global floor check probes only the umbrella `adlc` while `@adlc/gate-manifest` publishes standalone `gate-manifest`/`adlc-spend` bins whose documented commands write the manifest. All three gaps are contained today by the rails-guard forest gate at PR time (any root append is rejected); this ticket moves the failure earlier and removes self-attestation.\n\nBuild:\n\n1. **Trust-root the floor inputs.** Add `scripts/toolkit-floor.json`, `scripts/toolkit-floor-check.mjs`, and `scripts/test/toolkit-floor.test.mjs` to: (a) `REPO_TRUST_ROOTS` in `scripts/rails-guard-ci.mjs`; (b) the root `CODEOWNERS` (same owner, same comment style as the existing check-reviewer-directed-comments entries — a required gate whose source and test otherwise sit unprotected); (c) `TRUST_ROOT_FILES` in `packages/prosecute/lib/tier.mjs`, with a comment following the file's existing per-entry rationale style. A floor-monotonicity rule was considered and is omitted: the trust-root freeze routes EVERY change to the floor file — raise or lower — through the #141 ceremony, which is strictly more restrictive than monotonicity; recording that reasoning here is the decision record.\n2. **De-script the rails-guard job's install.** In `.github/workflows/ci.yml`'s `rails-guard` job, replace `run: npm install` with `npm ci --ignore-scripts` (the lockfile is the trust anchor; no candidate lifecycle script runs in the job that later holds `GH_TOKEN`). The gate scripts are zero-dependency and the workspace links they need are created without scripts, so no selective `npm rebuild` is required — if any later step in that job proves to need a native build, rebuild only that named package, mirroring the `test` job's allowlist pattern. Add a tracked-tree cleanliness assertion between the install and the `Rail-freeze gate` step: `git diff --name-only` over tracked files must be empty, so a mutated checkout is caught before any privileged step (same shape as the mutation-gate job's dirty check; `npm ci` does not rewrite the lockfile, so a clean tree stays clean).\n3. **Probe standalone manifest-writer bins in the preflight global floor check.** Extend `scripts/toolkit-floor-check.mjs` global mode: after the existing `adlc` probe, resolve each of `gate-manifest` and `adlc-spend` on the SAME scrubbed PATH (npm-injected `node_modules/.bin` entries removed). For a bin that resolves, determine its owning package version WITHOUT executing it: realpath the bin, walk up the directory tree to the nearest `package.json` whose `name` is `@adlc/gate-manifest` (global npm layout: `<prefix>/lib/node_modules/@adlc/gate-manifest/bin/...`), and compare that version against the floor with the existing prerelease-aware comparison. Failure shapes, all fail-closed: a resolvable bin whose owning package manifest cannot be located or parsed fails with an actionable message; a below-floor version fails naming the bin, the found version, and the upgrade command. A bin that does not resolve on PATH is not a failure (same contract as a missing `adlc`). The in-tree CI mode is unchanged (it already judges `packages/gate-manifest/package.json`). Update the preflight precondition comment and the check script header to name the standalone-bin surface.\n\nAcceptance criteria (automated tests; failure-path exit codes asserted exactly):\n- AC1 rail-freeze denies floor-input edits: with the new `REPO_TRUST_ROOTS` entries, a branch whose diff touches each of the three floor files makes `node scripts/rails-guard-ci.mjs <base>` exit 2 naming the trust root (verify per file; the existing rails-guard-ci test file shows the fixture pattern for exercising the wrapper's root list, or assert the wrapper's argv passes each new path with a source-level test consistent with how existing entries are pinned).\n- AC2 tier classifier: `classifyTrustRootTier({ changedFiles: [<each floor file>] })` reports trust-root tier with a reason naming the file (unit test alongside the existing tier.test.mjs cases); a control file (e.g. `scripts/changelog.mjs`) still does not tier.\n- AC3 CODEOWNERS: entries exist for the three floor files (test reads CODEOWNERS and asserts each path is present with an owner, same as the file's other entries).\n- AC4 install hardening: the rails-guard job in ci.yml contains `npm ci --ignore-scripts` and no plain `npm install`, and a cleanliness assertion step runs between install and the Rail-freeze gate (test extends the existing ci.yml-structure assertions in scripts/test/toolkit-floor.test.mjs or a sibling: step order pinned by index comparison, same as the existing floor-step-before-install assertion).\n- AC5 standalone below-floor bin fails preflight: fixture global-npm-layout tree with `lib/node_modules/@adlc/gate-manifest/package.json` at a below-floor version and a `gate-manifest` bin symlink on the scrubbed PATH, NO `adlc` anywhere: global mode exits 1, message names `gate-manifest`, the found version, the floor file, and `npm i -g @adlc/cli@latest`.\n- AC6 the probe never executes the bin: the fixture bin script writes a canary file when run; after AC5's check, the canary must not exist.\n- AC7 at/above-floor standalone passes: same fixture at the floor version and above (including a prerelease above the floor triple) exits 0; a prerelease OF the floor version fails.\n- AC8 unresolvable ownership fails closed: a `gate-manifest` bin on PATH with no locatable owning `@adlc/gate-manifest` package.json exits 1 with an actionable message.\n- AC9 absence is not failure: no `adlc`, no `gate-manifest`, no `adlc-spend` on PATH → global mode passes (existing behavior preserved); the full existing toolkit-floor test file still passes unchanged except where its assertions are extended.\n- AC10 the repository's own tree passes: `node scripts/toolkit-floor-check.mjs global` and `in-tree` exit 0 in the primary checkout, and the full suite is green.\n\nOut of scope: the T60 trust-root-change ceremony implementation itself (this ticket only extends the frozen set); hardening the live-canary jobs' installs (not required trust gates); changing `packages/gate-manifest` bins; the cross-model-gate workflow (already hardened); any change to `.adlc/manifest.d/` or the marker.",
  "category": "chore",
  "duration": 2,
  "edges": [],
  "id": "T-01KZXG6XAYFZ62TF4P6YBW6WXG",
  "rails": [],
  "scope": [
    "scripts/rails-guard-ci.mjs",
    "CODEOWNERS",
    "packages/prosecute/lib/tier.mjs",
    "packages/prosecute/test/**",
    ".github/workflows/ci.yml",
    "scripts/toolkit-floor-check.mjs",
    "scripts/preflight.mjs",
    "scripts/test/**"
  ],
  "title": "Harden the toolkit-floor enforcement boundary: trust-root the floor inputs, de-script the rails-guard install, probe standalone writer bins"
}
