{
  "body": "Spec: docs/specs/issue-autopilot-local.md (APPROVED 2026-08-26), section 14 'Required changes outside packages/autopilot'. This ticket is the PREREQUISITE of the @adlc/autopilot build ticket: every flag below is consumed by the autopilot orchestrator and none of them changes fleet's default behaviour when absent. Fleet is NOT trust-root tier, but env-scrub.mjs and sandbox.mjs are railed here because the autopilot's threat model (spec section 11) rests on them being unchanged.\n\n=== TASK ===\nAdd to packages/fleet (bin/fleet.mjs + lib/config.mjs + lib/run.mjs + lib/scheduler.mjs + lib/charters.mjs + lib/review-runner.mjs) the following OPERATOR-LOCAL CLI flags and config keys. Operator-local means: honoured from argv only; if the same key appears in the repo-committed .adlc/config.json fleet block it is warned and ignored, exactly as fleet.adapter / fleet.model are today (lib/config.mjs N1/K1 pattern).\n\n1. --no-pr : skip openPR at run end; the integration branch is left for the caller. Default unchanged (fleet opens exactly one PR).\n2. --no-complete : skip completeTicketOnIntegration after the post-merge gate; the caller owns ticket completion. Default unchanged.\n3. --dead-end-file <path> : the file's content (fenced by charters.fence, DEAD_END_MAX_CHARS cap) becomes the initial dead-end material for strike 1, so a caller can hand fleet the previous round's failure (preflight log, CI job log, conflict markers). Default: no initial dead-ends.\n4. --max-strikes <n> : replaces the hard-coded maxStrikes = 2 in advanceTicket. Integer 1..50. Default 2.\n5. --wall-clock-minutes <m> : an external deadline for the WHOLE run; when it expires fleet stops dispatching, records reason 'wall-clock', exits 2, and leaves the run resumable. Default: none (existing per-dispatch timeoutMinutes still applies).\n6. --charter-file <path> : the file's content is appended to builderPrompt AFTER the Constraints block (so the Constraints stay authoritative). Default: none.\n7. --pre-strike-argv <json-array> : a JSON array of strings executed with execFile-style argv and NO shell before every strike, with the orchestrator's env minus ADLC_MANIFEST_KEY (env-scrub NEVER_EXEMPT). Non-zero exit → fleet stops cleanly with reason 'quota-paused', exit 2, run resumable through the EXISTING status reconciliation (lib/resume.mjs reconcileRun) on the next identical invocation — fleet has no --resume flag and this ticket adds none. Default: none.\n8. fleet.reviewMaxBytes (repo config key, default 262144) forwarded to review-runner as adversarial-review --max-bytes; --allow-summary-review is never passed.\n9. --json result document gains: fleetRunId; review: { provider, verdict, revision, rounds }; and a machine-readable top-level reason from the fixed set { quota-paused, lock-held, wall-clock, strikes-exhausted, ticket-blocked, flail, review-unavailable } for every non-zero exit. The numeric exit code is unchanged; reason is authoritative for callers.\n11. --model-plane-read host|bounded and --model-plane-read-only <abs,abs,...> (operator-local): 'bounded' selects lib/sandbox.mjs READ_POLICY.BOUNDED for the MODEL plane (worktree + the adapter's synthetic home per homeState + the allowlist) instead of READ_POLICY.HOST; default unchanged ('host'). The --json result reports the effective readPolicy so a caller can assert it.\n12. --model-plane-git-sanitize (operator-local, only meaningful with --model-plane-read bounded): instead of binding the shared <repo>/.git read-only as-is, bind it read-only and overlay (bwrap --ro-bind-data / --tmpfs): (a) .git/config replaced by a generated copy that keeps only core.* and extensions.* keys (no remote.*, url.*, credential.*, include, includeIf, alias.*, core.hooksPath); (b) .git/hooks masked by an empty tmpfs; (c) .git/worktrees masked by a tmpfs with only the worker's own worktree entry re-bound; (d) .git/logs, info/exclude, FETCH_HEAD, ORIG_HEAD, COMMIT_EDITMSG and *.lock masked. The object database and refs remain readable (they are the repository's own history). --json reports gitSanitized:true.\n10. fleet run invoked with cwd = a LINKED git worktree must read that worktree's .adlc/tickets/ (not the main worktree's) and must create its nested worktrees under <cwd>/.worktrees/ and its integration worktree at <cwd>/.worktrees/fleet-integration. Verify, do not assume: today's worktrees.mjs resolves paths relative to repo root discovery.\n\n=== ACCEPTANCE CRITERIA ===\nAC1. Every flag above has a captured-argv or captured-config unit test in packages/fleet/test/ proving (a) the documented effect and (b) that omitting the flag leaves existing behaviour byte-identical (existing fleet tests still pass unchanged). VERIFY: node --test packages/fleet/test/ exit code 0.\nAC2. Operator-local enforcement: a repo .adlc/config.json fleet block that sets maxStrikes, wallClockMinutes, charterFile, preStrikeArgv, noPr, noComplete or deadEndFile produces the SECURITY warning and is ignored. VERIFY: packages/fleet/test/config.test.mjs asserts the warning text and the resolved value for each key.\nAC3. --pre-strike-argv is executed with shell:false and an argv array; a value containing shell metacharacters ('--model', 'opus;touch /tmp/x') reaches the child as ONE argv element and spawns no extra process. VERIFY: packages/fleet/test/pre-strike.test.mjs with a spawn recorder asserting argv and shell:false; ADLC_MANIFEST_KEY absent from the child env.\nAC4. --pre-strike-argv non-zero exit stops the run with reason 'quota-paused', exit 2, status file persisted, and a second identical fleet run invocation resumes via reconcileRun (stderr 'resuming run <id>', same fleetRunId in --json) from the same strike count; no --resume flag exists. VERIFY: packages/fleet/test/scheduler.test.mjs + resume.test.mjs.\nAC5. --wall-clock-minutes expiry mid-strike kills the worker process group, records reason 'wall-clock', exits 2. VERIFY: packages/fleet/test/run.test.mjs with fake timers.\nAC6. --json carries fleetRunId, review.{provider,verdict,revision,rounds} and reason for each non-zero path in the reason set; an exit-2 path with no reason is a test failure. VERIFY: packages/fleet/test/json-result.test.mjs table-driven over the reason set.\nAC7. --charter-file content appears in the builder prompt AFTER the Constraints block and the Constraints text is unchanged. VERIFY: packages/fleet/test/charters.test.mjs asserts ordering by index.\nAC8. Linked-worktree invocation: a test creates a real temporary repo, adds a linked worktree containing an extra ticket shard, runs fleet run --dry-run --json from inside it, and asserts the plan lists that shard and the planned worktree paths are under the linked worktree. VERIFY: packages/fleet/test/linked-worktree.test.mjs exit code 0.\nAC12. --model-plane-read bounded makes the sandbox args for the MODEL plane use READ_POLICY.BOUNDED with the given allowlist (assert no '--ro-bind / /' and that each allowlist path appears as an --ro-bind), the worker cannot read a file outside the set (real bwrap test, skipped loudly without bwrap), and --json reports readPolicy 'bounded'; omitting the flag keeps today's host policy byte-identical. VERIFY: packages/fleet/test/model-plane-read.test.mjs exit code 0.\nAC13. --model-plane-git-sanitize: a real-bwrap test (skipped loudly without bwrap) in which the worker process runs git rev-parse HEAD successfully but cannot read .git/config remote URLs, cannot list .git/hooks, and cannot see another worktree's entry under .git/worktrees; the generated config overlay contains no url/helper/include/includeIf/hooksPath/alias keys; --json reports gitSanitized:true; omitting the flag keeps today's behaviour byte-identical. VERIFY: packages/fleet/test/git-sanitize.test.mjs exit code 0.\nAC9. reviewMaxBytes reaches adversarial-review as --max-bytes <n>; --allow-summary-review never appears. VERIFY: packages/fleet/test/review-runner.test.mjs argv assertion.\nAC10. Rails: packages/fleet/lib/env-scrub.mjs and sandbox.mjs are unchanged (protected-paths.mjs is not railed so open issue #632 can be fixed independently). VERIFY: adlc rails-guard --base origin/main --ticket <this id> exit code 0.\nAC11. README + toolkit page document every new flag and the reason set; the dispatcher guard passes. VERIFY: node --test apps/docs/test/*.test.mjs exit code 0.\n\n=== NOT IN SCOPE ===\nThe autopilot package itself, .adlc/config.json, any change to fleet's sandbox/env-scrub/protected-path logic, PR body content.",
  "category": "feature",
  "duration": 2,
  "edges": [
    {
      "to": "T-01M0Z3FN7SAS4HAH7CS63YQ0DH"
    }
  ],
  "id": "T-01M0Z3G8MATGSZ0ECB6FAE0R08",
  "rails": [
    "packages/fleet/lib/env-scrub.mjs",
    "packages/fleet/lib/sandbox.mjs"
  ],
  "scope": [
    "packages/fleet/**",
    "docs/specs/fleet-orchestration.md",
    "apps/docs/content/docs/toolkit/fleet.mdx",
    "docs/package-reference.md"
  ],
  "title": "Fleet extensions the issue autopilot composes over (spec issue-autopilot-local §14)"
}
