{
  "body": "## Why\n\n`adlc spend` reports **nothing** on this repo's own ledger: *\"no recorded usage (0 of 164 manifest entries carry data.usage)\"*. The obvious reading is \"the write side is missing for P1/P7\" (issue #272's remainder). That reading is incomplete, and acting on it alone would build instrumentation that never fires for the operator who most needs it.\n\nThe ledger already contains the calls. `premortem` and `coldstart` entries are there. They contribute nothing because of the READ side:\n\n```js\nconst usage = entry?.data?.usage;\nif (!usage || typeof usage !== 'object') continue;   // ← the entry vanishes entirely\n```\n\nAn entry with no `usage` contributes **nothing — not even a call count**. So a call that demonstrably happened, but whose tokens were never measured, is *invisible* rather than counted as \"happened, tokens unknown.\"\n\nThat is precisely the failure T152 fixed one level down. `usageStatus: reported | claimed | unreported` exists because \"a zeroed object would book an UNMEASURED call as a measured free one and collapse *we don't know* into *it cost nothing*.\" The aggregation layer then reintroduces the same collapse in the other direction: an unmeasured call becomes *it never happened*.\n\n**Why this blocks the barbell specifically.** ADLC.md §6 wants spend heavy at P1/P5 and light at P4. The FIRST question that shape answers is \"are we doing P1 and P5 work at all, and in what proportion to P4?\" — a question call counts answer without a single token being known. Today the diagnostic cannot answer it, and `diagnostics()` returns `[]` for want of two phases with spend, so the operator sees silence rather than a shape.\n\n**And token counts are not coming for the dominant workflow.** Every LLM-backed gate supports `--prompt-only`, which is the documented path inside a harness (`/adlc:adlc` says so: \"you do not need API keys — run the tool with `--prompt-only`, answer the printed prompt yourself\"). Those runs make a real, expensive model call — the operator's harness makes it — and record a real verdict, with no token count available to the tool. Instrumenting `complete()`-based producers does not reach them. On a subscriptions-first stack the *majority* of lifecycle spend arrives this way.\n\n## What to build\n\n**1. `aggregateSpend` counts an unmeasured call instead of discarding it.**\n\nAn entry that carries `data.usageStatus` but no `data.usage` is a call that HAPPENED and was NOT measured. It must contribute to a per-phase **call count** while contributing nothing to token totals — never a zero-token call, which would state a cost the tool does not know.\n\nThe existing return shape must stay byte-compatible for every consumer that reads token totals: the counters `inputTokens`/`outputTokens`/`cachedTokens` are unchanged, and `calls` continues to mean \"calls counted here\". Unmeasured calls are surfaced as their own tracked quantity so a reader can tell a measured bucket from a partly-unmeasured one, and so nothing silently averages tokens over calls that never reported any.\n\n**2. `renderSpendReport` shows a shape when tokens are unknown.**\n\nToday the report short-circuits to \"no recorded usage\" whenever no entry carries `usage`. With unmeasured calls counted, it must instead render the per-phase call distribution and say plainly that token totals are unavailable for those phases. An operator seeing `P1: 4 calls (tokens unknown)` learns something true and useful; \"no recorded usage\" teaches them the gate is broken.\n\n**3. `diagnostics()` may reason about the shape, but must never price it.**\n\nA diagnostic that fires on call counts must SAY it is reasoning about call counts, not tokens, so its finding cannot be mistaken for a spend measurement. Where a §6 claim genuinely needs token magnitude, an unmeasured phase makes the answer **unknown**, reported as such — the §8c discipline that \"degraded data cannot silently pass\", applied here.\n\n**4. Write side: a prompt-only verdict records that a call happened.**\n\n`premortem --record-verdict` and `coldstart --record-verdict` capture an operator/harness answer to a real model call. They record `promptOnly: true` today. They must additionally record `usageStatus: \"unreported\"` — the T152 vocabulary, meaning exactly \"a call happened here and its tokens are not known to this tool\". No fabricated counters, ever.\n\n### Binding rules\n\n- **An idempotent REPLAY is not a second call (premortem finding 2, verified in source).** `packages/prosecute/lib/run.mjs` records a replayed pass as `{usageStatus: \"claimed\", usageReplayOf: <callKey>}` with **no** `usage` — deliberately, so the counters are not recorded twice. That entry matches the naive shape \"has a status, has no usage\" exactly, so a counting rule keyed on that shape would count one model call twice, re-introducing the multiplication T152's one-carrier-per-call rule exists to prevent — this time in a counter with no token total to make it visible. **An entry carrying `usageReplayOf` must never be counted.**\n- **NEVER fabricate a token count.** An unmeasured call contributes to counts only. A zeroed `usage` object is forbidden — it is the exact defect T152's rule exists to prevent, and this ticket must not reintroduce it at the aggregation layer.\n- **A measured total must never be diluted.** Adding call counting must not change any existing token total, or the share arithmetic that reads it.\n- **`spend.mjs` is not railed by any incomplete ticket** (verified), so it is editable — but it is the read side of a contract with several consumers. Its existing exported shape stays additive-only.\n\n## Acceptance criteria\n\n- An entry carrying `data.usageStatus` and NO `data.usage` contributes to its phase's call count and contributes ZERO to every token counter — asserted on both, so a fabricated or zeroed token total fails. Verified by `node --test packages/gate-manifest/test/spend-unmeasured.test.mjs`.\n- A ledger whose entries are ALL unmeasured produces a non-empty per-phase shape: `byPhase` has a bucket per phase that saw a call, every token total is 0, and the unmeasured-call count equals the number of such entries. Today this ledger aggregates to nothing at all. Verified by `node --test packages/gate-manifest/test/spend-unmeasured.test.mjs`.\n- A measured entry and an unmeasured entry in the SAME phase are distinguishable: the phase reports both its token totals and how many of its calls were unmeasured, so a reader can tell a fully-measured bucket from a partly-measured one. Verified by `node --test packages/gate-manifest/test/spend-unmeasured.test.mjs`.\n- Existing token arithmetic is unchanged: for a ledger containing ONLY measured entries, `aggregateSpend`'s token totals, `total`, and `entriesWithUsage` are byte-identical to the pre-change output for the same input. Verified by `node --test packages/gate-manifest/test/spend.test.mjs`.\n- `renderSpendReport` over an all-unmeasured ledger prints the per-phase call distribution AND states that token totals are unavailable — it must NOT print the \"no recorded usage\" dead end, and must not print a 0-token share that reads as \"this phase was free\". Verified by `node --test packages/gate-manifest/test/spend-unmeasured.test.mjs`.\n- A diagnostic derived from call counts names itself as such in its text, and any §6 claim needing token magnitude over an unmeasured phase reports **unknown** rather than a number. Verified by `node --test packages/gate-manifest/test/spend-unmeasured.test.mjs`.\n- `premortem --prompt-only --record-verdict` and `coldstart --prompt-only --record-verdict` each record `usageStatus: \"unreported\"` and NO `usage` key, driven through the real CLI into a real temp ledger; `aggregateSpend` over that ledger then counts one call at the gate's phase. Verified by `node --test packages/premortem/test/prompt-only-usage.test.mjs` and `node --test packages/coldstart/test/prompt-only-usage.test.mjs`.\n- No fabricated counter reaches the ledger from either path: the recorded entry has no `usage` key at all, asserted by key absence rather than by value. Verified by the two tests above.\n- An entry carrying `usageReplayOf` (an idempotent replay of a call already on the ledger) is NOT counted as a call — a ledger containing one real unmeasured call plus two replays of it counts exactly ONE. Verified by `node --test packages/gate-manifest/test/spend-unmeasured.test.mjs`.\n- Every affected segment is green: `node scripts/run-tests.mjs` exits 0, and `node scripts/mutation-gate.mjs origin/main --max 12` exits 0.\n\n## Context\n\n- Motivated by running `adlc spend` against this repo's own 164-entry ledger and getting silence, then finding the calls were present and being discarded.\n- `packages/gate-manifest/lib/spend.mjs` (`aggregateSpend`, `diagnostics`, `renderSpendReport`), `packages/premortem/lib/verdict.mjs`, `packages/coldstart/lib/verdict.mjs`, `packages/fleet/lib/adapters/usage.mjs` (the `usageStatus` vocabulary this reuses).\n- Issue #272 tracks the token write side for `complete()`-based producers. This ticket is deliberately NOT that: it makes the calls the operator ALREADY makes visible, which no amount of provider instrumentation would do for a `--prompt-only` workflow. The two compose — tokens land in the same buckets once a provider reports them.\n- No rails are declared. \"Existing token arithmetic is unchanged\" is an acceptance criterion instead, so this ticket cannot freeze `spend.mjs` for every other PR the way T152's rails did (#443 needed an admin override to expire them).",
  "category": "bugfix",
  "duration": 2,
  "id": "T-01KZ2C7K4ZQ1B5GYQDXWEGMTVT",
  "scope": [
    "packages/gate-manifest/**",
    "packages/premortem/**",
    "packages/coldstart/**"
  ],
  "title": "Count an UNMEASURED call instead of discarding it, so the barbell has a shape without token counts"
}
